{
  "scheme_id": "mudra_tarun",
  "name": "Pradhan Mantri Mudra Yojana – Tarun",
  "administered_by": "Department of Financial Services, Ministry of Finance (MUDRA Ltd. / NCGTC)",
  "scheme_type": "term_loan",
  "target_segments": ["small", "no_collateral", "manufacturing", "trading", "services"],
  "loan_range_min": 500001,
  "loan_range_max": 1000000,
  "interest_rate_min": 12.0,
  "interest_rate_max": 16.0,
  "collateral_required": false,
  "eligibility_vintage_months_min": 0,
  "eligibility_gst_required": false,
  "eligibility_sectors_included": [],
  "eligibility_sectors_excluded": [],
  "eligibility_geographic_restriction": "",
  "retrieval_text": "Growth-stage collateral-free loan above Rs 5 lakh up to Rs 10 lakh under the Pradhan Mantri Mudra Yojana (PMMY), for established micro and small non-farm enterprises in manufacturing, trading, and services seeking to scale up. Loans up to Rs 10 lakh fall within the no-collateral ceiling and are covered under the Credit Guarantee Fund for Micro Units (CGFMU). Available through scheduled commercial banks, regional rural banks, small finance banks, MFIs, and NBFCs.",
  "official_url": "https://www.mudra.org.in/offerings",
  "last_verified_date": "2026-07-10"
}
