{
  "scheme_id": "mp_mukhyamantri_udyam",
  "name": "Madhya Pradesh Mukhyamantri Udyam Kranti Yojana",
  "administered_by": "Department of MSME, Government of Madhya Pradesh",
  "scheme_type": "subsidy",
  "target_segments": ["micro", "small", "first_generation", "manufacturing", "services", "trading", "women", "sc_st"],
  "loan_range_min": 100000,
  "loan_range_max": 5000000,
  "interest_rate_min": 0,
  "interest_rate_max": 0,
  "collateral_required": false,
  "eligibility_vintage_months_min": 0,
  "eligibility_gst_required": false,
  "eligibility_sectors_included": [],
  "eligibility_sectors_excluded": [],
  "eligibility_geographic_restriction": "Madhya Pradesh",
  "retrieval_text": "The Madhya Pradesh Mukhyamantri Udyam Kranti Yojana provides bank-linked self-employment loans from Rs 1 lakh to Rs 50 lakh with a 3% interest subvention for manufacturing units and 2% for service and retail trade units, payable directly to the borrower's bank account for 7 years. Collateral guarantee cover is provided through CGTMSE, enabling collateral-free lending up to Rs 50 lakh. The scheme targets new enterprises promoted by Madhya Pradesh residents between the ages of 18-40 in manufacturing, service, or retail trade sectors. Applicant must have at least a Class 12 education. Apply through the MP state e-portal at samast.mponline.gov.in.",
  "official_url": "https://msme.gov.in/",
  "last_verified_date": "2026-07-12"
}