{
  "scheme_id": "karnataka_udyog_mitra",
  "name": "Udyog Mitra — Karnataka Industrial Incentives Package",
  "administered_by": "Department of Industries and Commerce, Government of Karnataka",
  "scheme_type": "subsidy",
  "target_segments": ["micro", "small", "medium", "manufacturing"],
  "loan_range_min": 0,
  "loan_range_max": 0,
  "interest_rate_min": 0,
  "interest_rate_max": 0,
  "collateral_required": false,
  "eligibility_vintage_months_min": 0,
  "eligibility_gst_required": false,
  "eligibility_sectors_included": ["manufacturing"],
  "eligibility_sectors_excluded": [],
  "eligibility_geographic_restriction": "Karnataka",
  "retrieval_text": "Udyog Mitra is the single-window facilitation and incentive package for manufacturing MSMEs in Karnataka under the New Industrial Policy 2020-25. Benefits include power tariff concessions, exemption from stamp duty and registration charges on industrial land, entry tax exemption on plant and machinery, concessional water charges, and price preference in Karnataka government procurement. A capital investment subsidy of up to 25% (capped at Rs 25 lakh for micro and small units) is available based on investment category and district. This scheme has no direct loan component; it provides a package of fiscal concessions to reduce the cost of setting up or expanding a manufacturing enterprise in Karnataka.",
  "official_url": "https://karnatakaindustry.gov.in/en/district-industry-centre/udyog-mitra/",
  "last_verified_date": "2026-07-12"
}