{
  "scheme_id": "national_sc_st_hub",
  "name": "National Scheduled Caste and Scheduled Tribe Hub (NSSH)",
  "administered_by": "Ministry of Micro, Small and Medium Enterprises",
  "scheme_type": "subsidy",
  "target_segments": ["sc_st", "no_collateral", "first_generation"],
  "loan_range_min": 0,
  "loan_range_max": 2500000,
  "interest_rate_min": 0.0,
  "interest_rate_max": 0.0,
  "collateral_required": false,
  "eligibility_vintage_months_min": 0,
  "eligibility_gst_required": false,
  "eligibility_sectors_included": [],
  "eligibility_sectors_excluded": [],
  "eligibility_geographic_restriction": "",
  "retrieval_text": "Support package for SC/ST entrepreneurs administered through the National SC-ST Hub (FY2021-22 to FY2025-26, total outlay Rs 588 crore): a 25% capital subsidy, capped at Rs 25 lakh, on bank-financed plant, machinery, and equipment under the Special Credit Linked Capital Subsidy Scheme (SCLCSS); reimbursement of up to 80% or Rs 1 lakh, whichever is less, of bank loan processing charges; reimbursement of up to 80% or Rs 1 lakh of Performance Bank Guarantee charges for government tender participation; course-fee reimbursement for management training at NIRF-ranked institutes; and membership-fee reimbursement for government e-commerce portals such as GeM, e-Khadi, and Tribes India. This is a subsidy and reimbursement package layered on top of a separately obtained bank loan, not a direct loan product in itself.",
  "official_url": "https://www.scsthub.in/",
  "last_verified_date": "2026-07-10"
}
